id_resto,amount_pictures,average_price,features,description
202,35,"$ (less than $20), $$ ($20 to $30)",,"At La Piazzetta, we want to offer our customers different great value products and services in order to make them live out of common experiences and gain their respect and loyalty. For this purpose, we do our very best to put forward a delicious first quality original food and beverage offer, meaning we thrive to innovate constantly.  We create stimulating areas where it is pleasant to be, for our customers, which are considered as guests and also our staff, for their well-being. We look forward to offer our clientèle an almost full range of complementary products.   We consider catering as a great and noble trade and we work with competent and passionate people. We constantly invest in our staff well-being and compentency so they can relate it to our clientèle by offering them a caring and professional service that sets apart from competition.show more"
203,26,"$ (less than $20), $$ ($20 to $30)",,"ZIBO! Restaurant-Bars offer a mouth-watering California cuisine featuring salads, pizza, pasta, grilled dishes, fish, succulent desserts as well as a generous wine list. Whether enjoying a drink at the bar or a meal in the dining room, a romantic lunch for two, an outing with friends and family, a business dinner or even a hopping happy hour, customers appreciate the warm and trendy atmosphere of ZIBO! Restaurant-Barsshow more"
205,26,"$$ ($20 to $30), $$$ ($30 to $45)",,"Jack Saloon Restaurant, a reinvented western resto-bar, has opened its doors in Vaudreuil-Dorion. Unique and recognized for its Tex-Mex food with international influences and its country/rock atmosphere, Jack Saloon offers a novel concept of culinary and musical experiences.show more"
206,32,$$ ($20 to $30),,"A lot of people asked me: Why Bananier ? Here is the story...  Have you ever smelled a steamed banana leaf? This unique scent will forever embody a flurry of my childhood memories, instantly unlocking flashbacks of the beautiful Asian continent, its unique dishes, vibrant market stalls, and trendy restaurants. Growing up, this same sweet leafy aroma led me to the kitchen, intrigued by my Ba Noi’s (grandmother's) culinary concoctions. A family passion for cooking passed on from generation to generation, my father introduced me to Thai flavor, technique, and creativity. Soon after, my parents guided me through the entrepreneurial challenges of their own restaurants, L'Escale a Bangkok and Red Thai, from staffing to sourcing, and from plating to customer journey.  Twenty more years alongside our city’s most amazing cooks and restaurateurs, inspired by childhood recipes and my own, I finally bring you ""Bananier Resto-Bar""!  You'll be able to find me in the front hall, running in and out of the kitchen. You'll also catch a glimpse of Papa Ngoc and Mama Ly in the kitchen.show more"
207,31,"$$ ($20 to $30), $$$ ($30 to $45)",,"Our family is proud to share our passion with you. From generation to generation, La Campagnola has never stopped growing and refining itself.La Campagnola first started in 1981 as a small Deli in the area, then in 1995, became a more popular sandwich shop (Camps), to later transform itself into a Bring Your Own Wine restaurant in 1999 with recognized homemade specialties throughout Montreal. In 2009, we decided to start aging quality canadian beef to add to our menu.Living in a changing world, the kitchen must follow this wave of change and renewal, so in 2018 we push our limits and standards to make you discover our new culinary experience of Italian Steakhouse, without forgetting our authentic tasty dishes. Through all these years, our priority is to make our customers have a unique experience every time. Your satisfaction is very important to us. Thank you to all our dedicated food lovers for your continuous encouragement. Dino, Joe and La Campagnola TeamLa Campagnola also offers private rooms and a catering service.show more"
208,27,"$$ ($20 to $30), $$$ ($30 to $45)",,"We are now located in a new strip mall at the corner of boulevard St-Charles and Highway 40 called Piazza Azzurri. Enjoy authentic Italian cuisine at Mundo Trattoria right in Montreal. We offer a wide variety of fine Italian cuisine: pasta, lamb, veal, seafood with our signature weekly Table d'Hôte offered during lunch and dinner that will surely please any taste buds. The service is always impeccable and the food is always delicious. Mundo Trattoria`s rustic decor gives the distinct impression of being in a genuine trattoria somewhere in the Italian countryside. We hope you will find any information you need on our website. Be sure to check our events page for upcoming special events and celebrations! Our weekly Table d'Hôte is also updated every week with our finest new creations for you to savour. The owners base their daily menus on the freshest and most interesting food they've been able to obtain on the market. Mundo Trattoria is also available for a full restaurant reservation to cater to your party or special event.show more"
209,18,"$ (less than $20), $$ ($20 to $30)",,"DAWAT has built a name for itself catering for weddings over the years, we have now opened up a take-out restaurant for all to enjoy :) DAWAT mission is to bring you quality food at a low price. By cutting out most overhead costs and buying in bulk, we guarantee the best bang for you hard earned buck.show more"
210,48,"$ (less than $20), $$ ($20 to $30)",,"Pacini in Rosemère is both beautiful and spacious with a chic and modern atmosphere. It is perfect for a family outing or for any other occasion. It appeals to both adults and children, with its all you can Bread Bar and bottled water always available. The wine selection is very interesting. Sometimes, you can sample a wine offered on promotion during a wine tasting event. Healthy food a varied and a tasty menu. An outstanding team that is always attentive to its customers. They will advise you with skill and courtesy on a wide range of products that are ready to be discovered and take-out. You will have an amazing choice!show more"
211,3,"$ (less than $20), $$ ($20 to $30)",,"Tomato Basilic is an unpretentious home cooking, focused on the quality of its ingredients and its preparation. It's also a warm place, a friendly atmosphere and a service that meets your expectations. Recognized for its excellent quality / price ratio, it is a place to discover and adopt.show more"
212,23,$$$ ($30 to $45),,"The French cuisine restaurant Tandem is located in Verchères on the South Shore of Montreal.
A fine cuisine signed Pascal Turgeon who will work with passion the products of his garden. "" From the ground to the plate with honest, sincere and intuitive French-Quebec inspired cuisine! Tandem is the new place on the South Shore where we serve food and drinks! A beautiful open kitchen facing the chef for beautiful gourmet evenings.
A beautiful menu that will charm the gourmets of the greater Montreal region and the South Shore. Tandem is only 15 minutes from Boucherville.
A wine list that will perfectly accompany the fine cuisine of Le Tandem, Sophisticated bottles combining the great classics with natural wine! A card that makes us travel and the agreements are finely tied.
Tandem is THE favorite restaurant on the South Shore and people from Montreal don't hesitate to cross bridges to get there. Reservations are strongly recommended.show more"
213,15,"$ (less than $20), $$ ($20 to $30)",,"Want to take a culinary journey to Vietnam or Thailand... come to La Perle Noire. La Perle Noire offers delicious Thai and Vietnamese cuisine. The room is great, very neat decoration. The restaurant is very family friendly, people come to share a good time together with friends, exchanging dishes in the good traditional Asian way.  The dishes are generous and a very good value for your money. You'll find delicious specialties such as grilled squid, grilled beef and many others...! Also try their delicious soups, nothing better than a good Vietnamese or Thai soup...  Fans of traditional Vietnamese/Thai cuisine and large family tables where it's fine to share food will not regret it here! A discreet and friendly service, a gourmet cuisine and a relaxed atmosphere, that's La Perle Noire!show more"
214,18,"$$ ($20 to $30), $$$ ($30 to $45)",,"Located in the heart of Centropolis and the city of Laval, Balthazar is the newest must-go-to location for your outings.   Specialized in Quebec microbrewery, we possess over 65 different beers, allowing you to experience extraordinary tastes and will give you the feeling you travelled across this beautiful province of ours. Our menu, inspired by our beers, will not only appeal to the ones with a fine pallet but also to those who love to eat. Our laid-back and warm atmosphere makes Balthazar the perfect place to catch up with friends.  Monday to Friday: This place is very appreciated for its Happy Hours (4 to 7) and its parties. People of all ages come together to create a friendly atmosphere.show more"
215,8,$ (less than $20),,Don’t miss the chance to try our best sandwiches along with our fresh juice.show more
216,24,"$$$ ($30 to $45), $$$$ (over $45)",,"The Bidon Taverne Culinaire evokes the perfect place to enjoy Montreal bistronomy in the heart of Sainte-Julie.  With its inventive and refined accents, Le Bidon invites you to a different and stimulating gastronomic experience.  Headed by our new executive chef, Bianca Rousseau, our kitchen is full of ardent talents.  Our manager/sommelière-advisor Valérie Cadieux, will be delighted to guide you through our unique choices of privately imported wines.  Great care is taken with our menu as well as our “off-menu”, traveling through a range of organic, biodynamic and natural wines, from the accessible to the most upscale.  The room team and the kitchen team combine harmoniously to offer you the absolute experience combining bistronomy and sommellerie.show more"
217,33,$ (less than $20),,"Want a delicious fresh pizza to enjoy at home? Let yourself be tempted by the Jacques Cartier pizzeria, where sunny tomatoes from Italy meet the quality of ingredients from Quebec.show more"
218,20,"$$ ($20 to $30), $$$ ($30 to $45)",,"La Vieille Banque Restaurant opened in 1984 in the former Provincial Bank of Canada building, in Old Sainte-Rose. Originally renowned for its wood-oven pizza, the chef transformed the establishment into an Italian fine cuisine restaurant in 1995.
It is a happy coincidence that the safe was converted into a kitchen, keeping the most audacious creations of its chef secure! Today, the restaurant is very popular for its terrace and warm atmosphere, in beautiful Old Sainte-Rose. Be it during the many festivals overlooking the boulevard (Rose-Art festival, children's festival, etc.), or after a leisurely walk along the Mille-Îles River, the inquisitive ones who stop inevitably end their pleasant day in an excellent way.
Whether for a romantic dinner, an evening with friends or a birthday reception, La Vieille Banque is always happy to welcome you and satisfy your every desire!show more"
219,14,"$$ ($20 to $30), $$$ ($30 to $45)",,"Louis & Jacob is the story of two brothers, both chefs, who following the success of their restaurant Le Milanais Fine Cuisine Italienne, decided to embark on a new adventure!Creative, cheerful and generous cuisine in a relaxed atmosphere.Our mission is to see you again.Louis & JacobOwners chefsshow more"
220,23,"$$ ($20 to $30), $$$ ($30 to $45)",,"A new Cocktail and Tapas Bar located in the heart of Plateau Mont-Royal, capturing the audacious spirit of our project.
Immerse yourself in a world where each cocktail is a unique work of art, created to awaken your senses and allow you to experience unforgettable moments in a comfortable and chic atmosphere.show more"
221,33,$ (less than $20),,"Want a delicious fresh pizza to enjoy at home? Let yourself be tempted by the Jacques Cartier pizzeria, where sunny tomatoes from Italy meet the quality of ingredients from Quebec.show more"
222,15,$ (less than $20),,"The Archibald Microbrewery is a delicious panini plate, BBQ chicken wings with whiskey or a supportive breakfast.  It is also a plate of hunting pleasures that will satisfy the most demanding appetite.  But above all, Archibald brews for you a dozen beers out of this world, such as Matante, la Joufflue, la Brise du lac, la Ciboire, la Choute, la Tite’Kriss, la Weiss and many others.  It's a date!show more"
223,16,"$$$ ($30 to $45), $$$$ (over $45)",,"Welcome to Rosélys, an evolutive bistro experience that evolves from morning to evening to the rhythm of local flavours.  Inspired by the French and English influences of Montreal’s heritage, the establishment is a wink to the city’s golden years.
The creative dishes and welcoming and luminous atmosphere are ideal for any occasion, from a casual business lunch to a grand family dinner, not to mention the Sunday brunch.  See life through Rosélys-coloured glasses!show more"
224,15,"$$ ($20 to $30), $$$ ($30 to $45)",,"Come taste our dishes inspired by the “Land of the Rising Sun” and discover our vast selection of sake, Japanese whiskey and privately imported wines.show more"
225,50,"$$ ($20 to $30), $$$ ($30 to $45)",,"Having become a must in the Laurentians, this popular, festive resto-bar now welcomes you in its new location. Whether you are in a chic or casual mood, alone or with friends, for a drink or to sample our new menu carefully prepared by our chef Jean François Baril, come relax in the bar, at a table or on the terrace.show more"
226,13,"$$ ($20 to $30), $$$ ($30 to $45)",,"At Madisons Restaurant & Bar, our goal is to provide you with an upscale casual dining experience you will never forget. Come and discover a warm yet trendy decor, a diverse menu set to satisfy the most refined palates, a modern and wide ranged bar, and of course, our staff who are always happy to welcome you! Madisons is the destination of choice for those looking to enjoy fresh cuts of meat hot off the grill that are perfectly seasoned and exceptionally cooked. The experience begins with our appetizer selection, most of which can be shared among guests. Move on to fresh fish, generous salads, our assortment of grilled meats or our famous ribs that are second to none, so tender they fall off the bone. All which are created to bring you gastronomic pleasure! For lunch, the menu has been designed to meet the needs of this busy time of day. Salads, exquisite sandwiches, as well as the selection of daily specials which are prepared according to the arrival of fresh products. Let’s not forget our spirited and cozy bar section where it always feels good to spend some time with friends, family or colleagues. Whether you’re enjoying a cocktail or having a beer while watching the game with the boys, our bartenders and wait staff will always make you feel welcomed. We hope to see you soon!show more"
227,15,"$$ ($20 to $30), $$$ ($30 to $45)",,"La Confrérie is a neighborhood bistro-pub with an original seasonal menu, reinvented cocktails, a good selection of beers and wines and delicious food.show more"
228,33,$ (less than $20),,"Want a delicious fresh pizza to enjoy at home? Let yourself be tempted by the Jacques Cartier pizzeria, where sunny tomatoes from Italy meet the quality of ingredients from Quebec.show more"
229,27,"$ (less than $20), $$ ($20 to $30)",,"Welcome to Chez Vincent! For mussels, fries and grilled meat at their best! Located in the heart of Old Longueuil, our restaurant-pub has a warm and relaxed ambiance. Our friendly and professional service have, over time, attracted a growing clientele.  We serve mussels, fries and grilled meats which is our specialty and we offer a wide range of imported beers and a nice selection of wines at very competitive prices.  For all your meals, business meetings, your evenings with friends or private events in our reception rooms, you get exactly what you want in an unbeatable value for money.  During the summer we will be happy to welcome you on our beautiful terrace.show more"
230,48,$$$$ (over $45),,"Historic building from 1830!
A rustic, warm and festive restaurant-pub. Tartare specialty and bistronomic cuisine.show more"
231,18,$ (less than $20),,"By opening a second location in Old Beloeil, the project of Isabella, Nicolas and Rebecca (owner of the QG du Vieux Laprairie), the ambition is always the same: a place where you can find yourself and meet with others.Get together with family, sip an old-fashioned hot chocolate and take advantage of the available board games... Find yourself, take the time to read a good book, have a coffee or an original tea ... Get together with colleagues for a gourmet lunch made with local artisanal products at reasonable prices ... As a couple, to chat and discover the latest homemade pastries ... Get together with friends for a hockey evening with beer & charcuterie pairing ... A suitable and comfortable place for everyone, family, friends or business associates…  To create and develop all these slices of life, Rebecca is driven by one belief: the quality of our crafts.  Being a meeting place is first to use and value the things you love in your immediate environment.  That is why, the products come from local or nearby craftsmen, the services offered are set up with the companies of La Prairie and promotions and activities within Vieux La Prairie are relayed and communicated.  The door is wide open ... so let's get together soon!show more"
232,46,$ (less than $20),,"Local produce, fresh and seasonal ingredients making for a comforting and casual eatery - serving specialty cocktails and delicious wines.show more"
233,40,$ (less than $20),,"For people living in the NDG district of Montreal, the name Resto Café Oxford conjures up images of what many have described as the best breakfast in Montreal and, in a city filled with breakfast places, that's sure saying a lot! The Resto Café Oxford on Sherbrooke in N.D.G. has been open since 1944, and has ever since transformed into not only a breakfast place but also a restaurant that has added many new items to the menu including steaks, salads, grilled chicken, submarines and popular Italian dishes such as many pasta, parmigiano, brushketta and more.  They sell a wide variety of breakfast specials including bacon and eggs, French toast, eggs Benedict's and what is known to be one of the best pancakes in Montreal.show more"
234,40,"$$ ($20 to $30), $$$ ($30 to $45)",,"It is impossible to enter without noticing the various cuts of dry-aged meat on site. Very few restaurants in Quebec offer this, another detail taken into account in order to stand out from the competition.  Moreover, we offer more than fifteen different cuts... there is something for everyone.show more"
235,9,"$ (less than $20), $$ ($20 to $30)",,"Le Nouveau Paragon can satisfy all your cravings.  Whether you’re in the mood for a pasta dish, a pizza, a submarine, a club sandwich or a Caesar salad, Le Nouveau Paragon won’t disappoint you!  Our unpretentious restaurant offers a varied menu and you can also bring your own wine.   Join us for a comforting relaxing brunch on Saturdays and Sundays.show more"
236,6,"$$ ($20 to $30), $$$ ($30 to $45)",,"Le Castel, a culinary experience.
Newly installed on Sherbrooke Street, Le Castel offers refined French cuisine. Executed by our talented chefs, our menus have been designed with attention to detail and flavor. Taste our calamari fried in charcoal powder, or the famous Cournouailles half-chicken with wild mushrooms...show more"
237,10,"$ (less than $20), $$ ($20 to $30)",,"Come and have fun in a relaxed atmosphere!The Randolph Pub Ludique Trois-Rivières invites you to play a host of games, offered and explained by our passionate entertainers. To make the experience more complete, our waiters and waitresses will come to see you to offer you something to eat and drink. Try our microbrewery beers, cocktails and potions while enjoying a variety of appetizers and dishes prepared by our experienced staff.show more"
238,20,"$$$ ($30 to $45), $$$$ (over $45)",,"The Bidon Taverne Culinaire evokes the perfect place to enjoy Montreal bistronomy in the heart of Saint-Lambert.  With its inventive and refined accents, Le Bidon invites you to a different and stimulating gastronomic experience.  Headed by our new executive chef, Marc-Alain Campeau, our kitchen is full of ardent talents, including Benjamin Binard as midday chef.  Our manager/sommelière-advisor, Valérie Cadieux, will be delighted to guide you through our unique choices of privately imported wines.  Great care is taken with our menu as well as our “off-menu”, traveling through a range of organic, biodynamic and natural wines, from the accessible to the most upscale.  The room team and the kitchen team combine harmoniously to offer you the absolute experience combining bistronomy and sommellerie.show more"
239,15,"$ (less than $20), $$ ($20 to $30)",,"Casa Alentejo restaurant is located on St-Hubert between Bellechasse and Rosemont. If you are a fan of Portuguese cuisine, Casa Alentejo restaurant is the perfect place to enjoy delicious charcoal grilled meats. The warm and inviting family atmosphere make this restaurant a great choice to bring your friends and family. Moreover, while consulting the menu, you'll find an incredible selection of succulent grilled meats and fish. The chef is happy to garnish plates generously, not forgetting, of course, to add the famous Portuguese fries! Really, Casa Alentejo restaurant is the perfect choice for your next outing. See you there!show more"
240,24,"$ (less than $20), $$ ($20 to $30)",,"Come and have fun in a relaxed atmosphere!The Randolph Pub Ludique Saint-Jérôme invites you to play a host of games, offered and explained by our passionate entertainers. To make the experience more complete, our waiters and waitresses will come to see you to offer you something to eat and drink. Try our microbrewery beers, cocktails and potions while enjoying a variety of appetizers and dishes prepared by our experienced staff.show more"
241,33,$ (less than $20),,"Want a delicious fresh pizza to enjoy at home? Let yourself be tempted by the Jacques Cartier pizzeria, where sunny tomatoes from Italy meet the quality of ingredients from Quebec.show more"
242,36,$ (less than $20),,"Déjeuner Cosmopolitain is an extraordinary, upscale all day breakfast and lunch restaurant. It has become a landmark in the Montreal area for the eclectic and health conscious individual. There are no preservatives, no trans-fat, and no chemicals in anything that is served.show more"
243,8,"$ (less than $20), $$ ($20 to $30)",,"Usine Grecque serves Greek cuisine and dishes such as souvlakis, pitas, salads, and Greek poutines, and more.show more"
244,47,$ (less than $20),,"Specialized in gluten-free treats, COOKIE STÉFANIE promises to always offer old-fashioned flavours for you to enjoy, as well as be an active member of the Old Montreal community.
Because we believe that people who suffer from Celiac Disease or who are gluten sensitive also have a right to enjoy the pleasures of delicious treats, we offer cakes for all occasions—without compromising the taste. Our products will please even the most demanding gourmets who have no dietary restrictions.
COOKIE STÉFANIE also offers catering services and corporate gifts.show more"
245,16,"$ (less than $20), $$ ($20 to $30)",,"Mexican restaurant with the best margaritas in town, best signature cocktails, guacamole, ceviche, tacos, chicken garnachero and much more...show more"
246,17,"$$ ($20 to $30), $$$ ($30 to $45)",,"Whatever your event or celebration, we are here to make your special day a truly memorable one. Mardin Palace private dining experts are more than happy to create custom floral arrangements.For parties of 8-12 we have the roastery table which is available for private hire.show more"
247,33,$ (less than $20),,"Want a delicious fresh pizza to enjoy at home? Let yourself be tempted by the Jacques Cartier pizzeria, where sunny tomatoes from Italy meet the quality of ingredients from Quebec.show more"
248,33,$ (less than $20),,"Want a delicious fresh pizza to enjoy at home? Let yourself be tempted by the Jacques Cartier pizzeria, where sunny tomatoes from Italy meet the quality of ingredients from Quebec.show more"
249,22,$$ ($20 to $30),,"Located in the heart of the old port of Montreal, La Catrina is an authentic and modern taste of Mexican cuisine from the esteemed Chef Jaques Coutu.show more"
250,41,"$$ ($20 to $30), $$$ ($30 to $45)",,"Enjoy a wide range of wines by the glass, a nice variety of Quebec and International beers all while savoring the bistro-style food. The carefully crafted menu by Emilia Rizzetto and Fabrice Coutanceau offers one of the most appealing tables in the Laurentians. LE SAINT-SAU, PUB GOURMET is a friendly gathering place. Our modern pub offers the best location in St-Sauveur, in the heart of la rue Principale, a south facing terrace and a sunny dining-room where you can enjoy all the local entertainment.show more"
251,6,"$$ ($20 to $30), $$$ ($30 to $45)",,"SHAKER Kitchen & Mixology arrived in the Granby area in January 2023! It is in the heart of the city center on Principale Street that the fifteenth restaurant of the chain takes place, more precisely in the former premises of Burger King.
Renovations have been made to revive the premises and bring it up to date with an atmosphere and decoration signed SHAKER. The place can accommodate 200 people seated and has a large central bar and a terrace.
Looking forward to welcoming you!show more"
