id_resto,amount_pictures,average_price,features,description
1,38,$$ ($20 to $30),,"DON'T LET THE NAME FOOL YOU
A very warm Decor for the cold season, a lively and sunny terrace for the summer season, market cuisine that evolves with freshness. Complimented by a young and dynamic team to accompany you during this experience, that's why Greasy Spoon has always been a must on Laurier since 2009.show more"
3,15,"$ (less than $20), $$ ($20 to $30)",,"Artigiani - where the art of turning dough the Neapolitan way! Being located on a street on the Plateau Mont-Royal, Artigiani proposes you to leap in the heart of Italy by enjoying a typical Neapolitan pizza cooked according to the rules of art. From appetizers to desserts, you will taste what Italy has to offer in all its splendor! Do not neglect to look at the wine list, you can taste some vintage wines without breaking your wallet!show more"
4,23,"$ (less than $20), $$ ($20 to $30)",,"The Kam Shing restaurant has served clients for over 20 years since 1997. Kam Shing Van Horne is quite close to the Van Horne exit of the Plamondon Metro station on the Orange line. On-street parking (meters) is plentiful as well as free parking nearby as well. The extensive menu was recently updated and added to (more than 200 items) of Cantonese and Szechuan items. The food is authentic Chinese and is rated by many among the very best in Montreal. The portions are very generous and many diners take home the remainders for next day. The food is reasonably priced, delicious and served very fresh and of the highest quality. The restaurant is described as serving such outstanding items such as Hot and Sour soup, General Tao Chicken, Salt and Pepper shrimp, Cantonese Chow Mein, Peanut butter dumplings Chicken and green peppers or broccoli with rice noodles in black bean sauce. There are many vegetarian dishes, some gluten-free dishes and MSG free if requested. The restaurant is fully licensed and offer a variety of beers including Chinese beers, Saké, wine and several other beverages.show more"
5,23,"$ (less than $20), $$ ($20 to $30)",,"Discover our new brewery, proudly local, where beers brewed by Brasseurs du Monde come to life. Our mission? Share our passion for beer while offering a unique experience, reflecting our world. We are ambassadors of discovery, where each beer tells a story. It's time to come and remake the world, one glass at a time.show more"
7,10,"$$ ($20 to $30), $$$ ($30 to $45)",,"Discover our menu, concocted by our Production Chef, Ghislain Roy. Homemade products, chosen with great care to satisfy you as well as a beautiful variety of microbrewery beers.show more"
8,12,"$ (less than $20), $$ ($20 to $30)",,"Brasserie des Rapides is a family-owned restaurant and bar located in LaSalle.  Since 1990, BDR is known for it's friendly atmosphere and generous portions at reasonable prices. Everyday you can find the mother of the family, Maria Macri, in the kitchen marinating her perfectly seasoned chicken wings or cooking her classic dishes like lasagna and Fish n’ Chips. For over 30 years, BDR is proud to serve hand-crafted dishes and provide their guests with a truly remarkable experience.  With two bars, a sunny terrace, a large selection of wines and over 12 draft beers, BDR is the perfect place in Lasalle for gatherings with friends!  Open every day from 7am, BDR also offers breakfast during which you can enjoy a classic eggs benedict or Belgian waffles topped with fruit and whipped cream.show more"
9,11,"$$ ($20 to $30), $$$ ($30 to $45)",,"Who does not dream of being in Italy, a country known around the world for its comforting dishes  This is what La Tomate Blanche offers you a few steps from your home, on the South Shore of Montreal.  With its Italian cuisine of unexpected flavors and advanced culinary techniques, all in a modern atmosphere, La Tomate Blanche is the place to rediscover Italian classics.show more"
10,17,$$ ($20 to $30),,"Piatti Pizzeria offers authentic Italian cuisine for all occasions.  Whether for a business lunch, a dinner with friends or a romantic evening, the friendly and elegant atmosphere of our restaurant will make your evening memorable.  Our wood oven pizzas will delight you, as well as our other dishes offering all the quality of Italian cuisine without pretention or fluff.  Our “tables d’hôtes” are renewed each week to offer even more variety.  You can accompany your meal with a glass of wine from our private import wine list to pair with your meal.show more"
11,24,"$ (less than $20), $$ ($20 to $30)",,La Colonie Thai restaurant offers a wide variety of Thai meals. The enthusiastic team will be thrilled to help you experience the fine cuisine in a soothing and fresh environment. We welcome small or large groups.show more
12,17,"$ (less than $20), $$ ($20 to $30)",,"Brewed in the heart of Old Montreal, our beers have been elaborated religiously for the past decade.  Whether you choose our traditional beers or our more unorthodox ones, our cuisine will know how to match them: from burgers to tartare, without forgetting tacos.
All in a chic and casual ambiance, enough for a nun to rescind her vows.show more"
13,24,"$$ ($20 to $30), $$$ ($30 to $45)",,"A blend of fine French cuisine and modern Montreal gastronomy
To offer an inventive twist on authentic European cuisine, we infused French traditions—market-fresh products, culinary techniques and impeccable service⁠—with forward-thinking Montreal cuisine. In a decor inspired by iconic Parisian brasseries, savour our specialties de la maison such as fish, seafood, steak, chicken, seasonal vegetables and fine cheeses.
A summer terrace and the ambience of a Parisian brasserie in Old Montreal
The elegant and intimate dining room bathed in natural light perfectly complements the culinary experience that awaits you. On warmer days, the lush terrace, located on the vibrant De la Commune Street, is open from noon to night.show more"
14,27,$$ ($20 to $30),,"Discover reinvented cuisine and daring recipes that combine elegance with modernity…At the Gourmeyeur boutique, you will find a wide choice of dishes every day to eat in or to take away. Our varied menu of fresh cooked products will delight the most discerning gourmets. Also take advantage of private chef and high-end catering services to celebrate at home. Breaking away from everyday life while enjoying flavor and health, that’s the Gourmeyeur experience.All our prepared dishes, as beautiful as they are delicious, are a poetic invitation, an unexpected and colorful journey of flavors.A real pleasure for all the senses…All desires, from the most refined to the easiest to take with you.show more"
15,20,"$$ ($20 to $30), $$$ ($30 to $45)",,"Located in an ancestral home built in 1895 in the heart of Old Sainte-Rose, Restaurant Amato serves authentic Italian cuisine in an intimate setting with warm décor. We are especially proud of our terrace which is known as one of the most beautiful terraces in Laval, or even in Quebec. In addition to feeling amazed in a garden with so many beautiful flowers, the terrace also has a fountain, a gazebo and auxiliary heating. Come enjoy our little corner of paradise!show more"
16,20,"$$ ($20 to $30), $$$ ($30 to $45)",,"Rotisserie Panama touches all 5 senses: mouth-watering taste on your palate, the vision of a modern Greek-Isle décor, the finger-licking touch of our famous grilled chicken, lamb chops and fish, the music and sounds of Greece, as well as the aromas of beautifully crafted and artistically presented dining creations.   With our tantalizing flavors of the Mediterranean, we, at Panama, take great pride in serving only the freshest food. All produce is bought daily to ensure quality, freshness, and only the best.   We offer our clients a unique and unforgettable dining experience. Recreating the traditional Greek way, Panama fosters a concept of family style dining and sharing. Our contemporary menu is skillfully created to cater to everyone’s tastes and is great for big groups and families. We also offer an extensive wine list with a wide selection to please all.   If you are ready to make unforgettable memories, come by and visit us, where a good time and an exceptional experience are guaranteed. Panama’s only goal is to make sure that everyone leaves completely satisfied and happy.show more"
17,36,$$$ ($30 to $45),,"Offering authentic and freshly prepared Oriental cuisine in the Montreal region.  Enjoy a cozy and friendly atmosphere that is set to warm your senses with a menu sure to please everyone.  We remain dedicated to providing an ultimate dining experience with great food and great service.Our mission is to offer fascinating and delicious food of a very high quality.  Our menu features a range of authentic Thai dishes sure to please even the most discerning diner.  Each meal is prepared and cooked fresh upon ordering to offer you the most flavorful of kosher ingredients.When it comes to vegetarian dishes, we make it possible for many of our recipes to be converted to vegetarian or vegan without destroying the original taste of our wonderful food.show more"
18,20,"$$ ($20 to $30), $$$ ($30 to $45)",,"La Boqueria is a tapas bar in Old Montreal where warm atmosphere and Mediterranean authenticity meet. From fresh seafood to Iberian cold meats and paellas, Boqueria will take you on a journey with every bite.show more"
19,7,"$ (less than $20), $$ ($20 to $30)",,"Rotisserie Chalet Bar-B-Q opened its doors in August 1944. Over the years we have built a legendary reputation for the best roast chicken in the world. This really is the connoisseur's choice! We selectively buy wholesale chicken, always fresh and plump. Our chickens are slowly roasted in brick kilns on real maple charcoal. We ensure that all our chickens are gold and crisp on the outside, tender and juicy on the inside. When served with our famous home-made dipping sauce, nothing compares. Simply delicious. Bon Appetit!show more"
20,20,$ (less than $20),,PROVEN FAST FOOD CHAIN IN THE QUÉBEC REGION. YOU WILL BE AMAZED WITH THE QUALITY WE OFFER. COME AND ENJOY THE BEST SERVICE! BON APPETIT!show more
21,8,"$$ ($20 to $30), $$$ ($30 to $45)",,"Welcome to Restaurant Le Côte What is Le Côte ? Le Côte is the ideal place to enjoy grilled meats, seafood or local cuisine just prior to attending performances at the Cabaret Eastman. Set in the 4gb complex, Le Côte is now neighbor to Cabaret Eastman. The Menu Le Côte will make you live a unique experience with its fresh and high quality meats and seafood. Our mouth-watering selection of USDA Prime Dry Aged meat procured from the largest Boucher store in Montreal has a taste and texture that is unique and delicious. Our cuts and portions are generous and the sides are accompanied to ensure you have the best dining experience each time.show more"
22,13,"$$$ ($30 to $45), $$$$ (over $45)",,"East Pan-Asian Restaurant serves cuisine in a modern and eclectic decor reminiscent in some details of the effervescent days of old Shanghai.Born from a very personal approach by owner restaurateurs, the concept of the East was developed with the intention of introducing customers to favorite dishes. Each dish on the menu is distinguished by its flavor and history depending on its country of origin.  All lovers of Asian cuisine will be happy to remember them or simply discover them for the first time.The East is also the perfect place to gather with friends and work colleagues after a busy day to enjoy a cocktail menu that invites travel.  Developed by Lawrence Picard, the menu offers classics and creations with an “Old Shanghai” touch.  Also being the restaurant of the Renaissance Montreal Hotel, the East offers hearty breakfasts (traditional and a selection of Dim Sum) every day of the week.show more"
23,38,$ (less than $20),,"Indian Takeout Restaurant
At Curry Karim, we take pride in being the go-to restaurant in Montreal, offering a delectable selection of authentic Indian dishes. With our commitment to using fresh, locally sourced ingredients and traditional recipes, Curry Karim Take out brings the vibrant flavors of India to the multicultural city of Montreal.show more"
24,24,"$ (less than $20), $$ ($20 to $30)",,"ZIBO! Restaurant-Bars offer a mouth-watering California cuisine featuring salads, pizza, pasta, grilled dishes, fish, succulent desserts as well as a generous wine list. Whether enjoying a drink at the bar, a meal in the dining room or in a private setting, a romantic lunch for two, an outing with friends and family, a business dinner or even a hopping happy hour, customers appreciate the warm and trendy atmosphere of ZIBO! Restaurant-Bars.show more"
25,72,$$ ($20 to $30),,"Pizzeria Gusto offers you the taste of Italy through the ingredients and methods used in all our dishes, ranging from homemade pasta, fish, pizzas of all kinds.  It will be an unforgettable experience at all times.  Make it your choice for an evening with the whole family.  For those who like to eat, laugh and surrender, come and share our passion for the greatest pleasure of life: good food!show more"
26,33,$ (less than $20),,"Bistro l'Evidence welcomes you in a warm and intimate French-style Brasserie. Located in the heart of Montreal, on St-Denis Street between le Plateau Mont-Royal and the Latin Quarter, this is the perfect place to start the day with a breakfast of champions or to start the evening with quality flavors. L'Evidence offers a complete menu, a la carte as well as table d'hôte. We prepare traditional and healthy recipes with fresh products, regularly varying our table d'hôte based on market arrivals. Enjoy a fresh, original, contemporary cuisine whose variety will appeal to everyone. Our chefs pay special attention to the preparation of dishes that are on offered each day, to ensure that the culinary artworks mingled with the friendly atmosphere meet your expectations, both in terms of quantity and quality. The outdoor terrace in the heart of Le Plateau and the segmentation of the interior room make it an ideal location both for brunch or to organize private and professional events. Thus, whether for a stopover, a lunch, a dinner, a drink or even for a group celebration, here you will find the what you need.show more"
27,25,$$ ($20 to $30),,"Portuguese Grill chicken since 1974!
This increasingly popular Portuguese grill, restaurant Jano, for many years has been offering a refreshing sanctuary in the most animated section of the Main. Serving the same country cuisine and earning a reputation for their charcoal grilling and features a top-secret marinade that keeps people coming back. Sample menu at Jano: Portuguese green cabbage soup (Caldo Verde), grilled sardines, sweet peppers, grilled trout and red seabream, grilled lamb cutlets, grilled Portuguese sausages, crème caramel (pudim flan), etc...show more"
28,15,"$ (less than $20), $$ ($20 to $30)",,"Our goal: Deliver a “bang” experience for all customers! On the menu: a casual atmosphere, but mostly a variety of exceptional sushis available in store or at home with delivery. With 18 restaurants all over the province of Quebec, Sushi Taxi works in order to be always more connected to its clients and commits to grow in a sustainable way.show more"
29,14,"$$ ($20 to $30), $$$ ($30 to $45)",,"Rosso Cielo is located on the second floor of the Courtyard hotel, just a few steps from Bell Square and Montmorency metro station. We serve breakfast, lunch, and dinner.show more"
30,14,"$$$ ($30 to $45), $$$$ (over $45)",,"Mythik is a trendy restaurant and bar that invites lovers of fine dining to take a seat in a chic setting promising a lively ambiance reminiscent of the most popular speakeasy lounges. The “farm-to-table” à la carte menu features a selection of individual plates, all beautifully created to highlight some of Montreal’s best local products. Enjoy signature cocktails carefully mixed, stirred or shaken to your taste by our talented team of mixologists. Wine lovers can choose from a selection of over 800 bottles.show more"
31,21,"$$$ ($30 to $45), $$$$ (over $45)",,"Discover 40 Westt, in Montreal’s West Island. Located Minutes from the airport and in close proximity to the downtown core, our establishment offers the finest CANADIAN Prime beef on the market. We dry age the beef in our own meat lockers for a period of 28-35 days, on display for all of our guests to see. 40 Westt also offers great martinis, an affordable lunch table d’hote, as well as impressive jazz performances on the weekends. Whether you’re looking for the best steak around, fresh shucked oysters, sinful desserts and/or an evening of entertainment, 40 Westt has all of the ingredients for an unforgettable experience.show more"
32,36,$ (less than $20),,"On the menu you will find a choice of fresh products, cooked in accordance with the authentic taste and fish recipes from around the world.
Do not hesitate to contact us for more information.show more"
33,18,$ (less than $20),,At Munchiz you can find completely unique snacks that come from all over the world with insane flavors!show more
34,15,"$ (less than $20), $$ ($20 to $30)",,"Sésame offers a concept unique in its kind: an out of the ordinary variety of high quality Asian dishes to enjoy in a warm atmosphere.   From the Pad Thai to the General Tao poutine, or one of the various wok sautées, you can eat your meal on site or take it to go.  Additionally, Sésame offers a wide selection of loose teas, several privately imported wines, beers on tap, a wide selection of sake, but especially, a menu of exclusive Sésame cocktails.show more"
35,6,"$$ ($20 to $30), $$$ ($30 to $45)",,"The first family restaurant to open in the Montérégie region, the SHAKER St-Hyacinthe has been welcoming its customers since July 2018.  Taking place in the premises of the former restaurant La Cage - Brasserie Sportive, there are 225 seats, including around forty around its central bar in addition to its terrace which offers 60 seats.  The SHAKER St-Hyacinthe has a large, convivial table called ""Le Bordel"".  It is a real central meeting point, allowing several groups to be accommodated simultaneously without a reservation.BE FABULOUS!show more"
36,18,$ (less than $20),,"We are proud to offer a modern public house the respects the rich history of this heritage building. Located in Downtown Montreal, McLean's Public House offers a cozy atmosphere, big screen TV's for sports fans, great food and excellent service with a very friendly staff.show more"
37,24,"$$ ($20 to $30), $$$ ($30 to $45)",,"Located in Verdun, la Bêtise is the result of four friends who were wondering how to enhance food and wine pleasures.  The tapas lounge-bar formula was created to offer an extraordinary evening to enthusiasts of culinary experiences: explosive tapas for all pallets, inventive main dishes, elaborate and original wine and cocktail list. You can share and explore classics that are adapted to fine cuisine in a warm and relaxed atmosphere.  La Bêtise is the ideal place for a good time.show more"
38,41,"$$ ($20 to $30), $$$ ($30 to $45)",,"État-Major restaurant is located on Ontario Street near Jeanne d'Arc, in the Hochelaga-Maisonneuve district. This beautifully decorated restaurant with a cozy atmosphere will allow you to evade the bustle of the big city. Come savor its delightful French cuisine, made with fresh market ingredients. The varied and exciting menu offers a choice of fish, meat, foie gras, and different main dishes, including a delicious duck an exquisite beef strip loin. Be sure to bring your favorite bottle of wine to accompany your culinary experience. One visit will have you convinced!show more"
40,10,$$$ ($30 to $45),,"Nestled in the heart of the West Island; La Verità is an Italian fine dining experience that is bound to impact your senses. Our focus is to ensure our clients delight with the restaurant's modern Italian cuisine, while surrounded by a warm and trendy decor. A relaxed atmosphere is what has allowed La Verità to be the new trend in upscale dining. Our experienced and devoted staff will go the distance when it comes to professional, friendly service, combined with a dining experience beyond your expectations. To establish a comfort for our clientele, signature dishes have become a staple on our table d'hôte menu; our chef's flair and creativity allows us the opportunity to constantly incorporate new experiences to satisfy the adventurous palate. The dining experience at La Verità is never unvaried, with a menu that changes weekly. Choices feature a wide variety of pastas, risottos, poultry, meats, fresh fish, and so much more.show more"
41,38,"$ (less than $20), $$ ($20 to $30)",,"L'Ambroisie and L'Espace Canal are located in the courtyard of Chateau St-Ambroisie, a historical heritage building situated on the edge of the Lachine Canal in the St-Henri district of Montreal. Only a few minutes from downtown, the restaurant welcomes a business clientele and groups of friends, in a casual atmosphere. Stuart Abrams, chef and owner, invites you to discover his establishment, renowned for its terraces and elegant reception rooms.show more"
42,12,"$$ ($20 to $30), $$$ ($30 to $45)",,"Mista is located in the heart of charming Old Beloeil, near the Richelieu River.   The menu is made up of inventive Italian cuisine dishes that push the envelope of today’s culinary trends.  Inside the restaurant you will find a warm and cozy ambiance that is the envy of many restaurateurs.show more"
43,15,"$ (less than $20), $$ ($20 to $30)",,"Sésame offers a concept unique in its kind: an out of the ordinary variety of high quality Asian dishes to enjoy in a warm atmosphere.   From the Pad Thai to the General Tao poutine, or one of the various wok sautées, you can eat your meal on site or take it to go.  Additionally, Sésame offers a wide selection of loose teas, several privately imported wines, beers on tap, a wide selection of sake, but especially, a menu of exclusive Sésame cocktails.show more"
44,24,"$ (less than $20), $$ ($20 to $30)",,"Le Shack du Pêcheur is a fish restaurant located on Lionel-Daunais street in Boucherville.  On the menu you will find a choice of fresh products, cooked in accordance with the authentic taste and fish recipes from around the world.  Do not hesitate to contact us for more information.show more"
45,16,"$$ ($20 to $30), $$$ ($30 to $45)",,"Korean based fusion BAR right in the center of Montreal Downtown. Cool stop for Korean fare including bulgogi nachos, chicken wings & sashimi, with hip ceiling decor.show more"
46,28,"$$ ($20 to $30), $$$ ($30 to $45)",,"Friendly restaurant where the service and the pleasures of wine are in the spotlight, bistro and wine bar Les Cavistes on Fleury West, in the heart of the Ahuntsic district, offers a cozy bistro inspired cuisine tinged with Quebecois pride. Our privately imported wines are not found at the SAQ.show more"
47,17,$ (less than $20),,"Welcome to Pub BreWskey, the neighborhood pub in Old Montreal! 
Initiated by three friends passionate about gastronomy, beer, and whisky, the BreWskey project came to life in 2015 with the opening of its first establishment. Focusing on our house-brewed beers, a refined selection of whiskies, and comforting pub cuisine, our pub embodies the simplicity of the principle that we offer you the products and service we would appreciate as customers.  At the pub, you have access to our on-site brewed beers through 20 draft lines, in addition to a wide selection of carefully chosen whiskies and other premium spirits. Our pub, the most ""intimate"" among our three locations, provides a warm atmosphere perfect for small groups. In the summer, enjoy our spacious terrace on Saint-Paul Street and soak in the atmosphere of Old Montreal!show more"
48,10,"$$ ($20 to $30), $$$ ($30 to $45)",,"YEN Cuisine Japonaise, a hidden restaurant in heart of downtown Montreal combines traditional Japanese cuisine with a contemporary gastronomy experience, all within an intimate yet sophisticated ambiance.show more"
