id_resto,amount_pictures,average_price,features,description
669,14,$$ ($20 to $30),,"Please don't be fooled by this restaurant's modesty... Although small in size, there are plenty of gastronomic treasures to discover at this restaurant that blends into the landscape of the great cosmopolitan city of Montreal. Atami, which means ""warm sea"" from its Japanese roots, is the first sushi restaurant to open its doors in the neighborhood. After already 15 years of existence, it's still oozes colors and flavors, ready to seduce you each time you visit. Come try one of our lunch tables d’hôte's which include five delicious services. And at night, come and discover our savory dishes and unique specialties, all ready to be washed down with a delicious wine from our vast wine list selection. In a truly warm atmosphere, let yourself be carried away by your desires as the chef prepares you one of his unforgettable creations. To end the evening perfectly, succumb to one of our decadent desserts...eat it alone (because you know it's too good) or share it (for the romantic in you). The ingredients are always of an incredible freshness and variety, of endless generosity and, above all, they are sprinkled with a hint of love that makes all the difference! So if you want to enjoy the art of eternal love, this ""warm sea"" will never cease to amaze you by constantly reinventing itself. And what is the best part of all this? Prices are extremely affordable and everyone can enjoy it, and hopefully you'll enjoy it forever...show more"
671,23,"$$ ($20 to $30), $$$ ($30 to $45)",,"Et Caetera restaurant is located in old Beloeil. Its combination of bring your own wine and cuisine distinguish it from other restaurants. Throughout the year you will find mussels, pasta, grilled meats and fish. The appetizers and desserts are homemade. In the summer, the intimate terrace, veiled by the shadow of the St-Mathieu's steeple, is a haven of peace. You will be welcomed into a spacious and bright dining room where the decor reflects the relaxed and convivial Mediterranean dining tables.show more"
672,11,"$$ ($20 to $30), $$$ ($30 to $45)",,"The concept of Zoé Fondues Karaoke & Cocktails is simple. From 5pm to 8pm, future singers warm up their voices by enjoying a cheese fondue, a Chinese fondue or a grilled steak. You can opt for the table d'hôte which includes Caesar salad, traditional Swiss cheese fondue, your choice of Chinese fondue including baked potatoes, sour cream, sauces and Belgian milk chocolate fondue. Those who opt for a beef or chicken Chinese fondue will have unlimited chicken or beef.   From 8pm until 3am, the room transforms into a karaoke bar with light shows, lasers and smoke machines. The timid ones can sip a few cocktails before going on stage to give their friends a memorable performance. The Zoé Fondues Karaoke specializes in cocktails with almost 100 choices. Musically, with over 150,000 song titles available in French, English and Spanish, even non-music lovers will find a song they like to give a spectacular performance.show more"
673,33,$ (less than $20),,"Want a delicious fresh pizza to enjoy at home? Let yourself be tempted by the Jacques Cartier pizzeria, where sunny tomatoes from Italy meet the quality of ingredients from Quebec.show more"
674,16,"$$ ($20 to $30), $$$ ($30 to $45)",,"At Lana’s Bistro & Bar à Vin, we care about spreading our love and passion to your plates. The owner, Sarah, with the help of her two partners, Ali and Andréanne, brought her dream to life by naming the restaurant after her daughter, to whom she dedicated her life and career.In the catering field for over a decade, the owners have always taken the time to create a sincere and warm dynamic with their customers. We are proud to have started a family among our staff and customers, and hope to continue this with this bistro.We consider that a tasty meal and a good glass of wine shared with our loved ones constitute memorable moments, hence our goal to bring unique touches to our eclectic dishes, representative of our history and our journey.Our guarantee: an unforgettable experience.show more"
675,14,"$ (less than $20), $$ ($20 to $30)",,"Dishes to go, vegan options, world food, home-made meals.show more"
676,24,$$ ($20 to $30),,"The Tomeo family has been cooking for you at Terracina restaurant since it was founded in 1991.  The whole team rolls up their sleeves and pitches in to offer you an unforgettable culinary experience.  We offer impeccable service that is personalized and attentive; with us, you will find a warm and authentically Italian atmosphere.show more"
677,36,"$$$ ($30 to $45), $$$$ (over $45)",,"Le Bières et Compagnie offers you authentic, comforting and friendly cuisine.  Our wide range of beers from microbreweries from all over the world, private import wines and our Quebec spirits will charm you!  Be ready to become members of the Bière et compagnie family and let yourself be abandoned in the adventure and the discovery of diverse beers, in a warm and relaxed atmosphere.show more"
678,45,$ (less than $20),,Dolce & Santella is the pleasure of savoring an exquisite gelato made from only the finest local ingredients.show more
679,14,$$ ($20 to $30),,"Located on one of Saint-Sauveur’s most beautiful sites the Feliciano offers fine cuisine in a decor that is both lavish and warm.  The owners, Nicole and Alberto, invite you to a true culinary journey inspired by a varied menu and your favorite wine.  In summer, the Feliciano Restaurant welcomes you to the most spacious terrace in the Laurentians.  Enhanced by a beautiful fountain, the ambiance and comfort of the place promise you an enchanting Mediterranean crossing.show more"
680,20,$ (less than $20),,Da Bologna is city-renowned for its unbeatable homemade pizza dough and amazing subs.  Italian family restaurant opened since 1958.show more
681,7,$$ ($20 to $30),,"We are proud to offer you an exceptional dining experience with our creative and flavorful vegan menu. Whether you're a long-time vegan or simply curious about new flavors, And that's not all ! We are also passionate about quality drinks. We have selected for you the best organic or natural wines See you soon !show more"
682,18,"$$ ($20 to $30), $$$ ($30 to $45)",,"THE TRUE ART OF SUSHI IS AIKAWA An ultimate sushi restaurant in the heart of the West Island. Come and enjoy the dining experience in our elegant, warm, and relaxed dining room which features a large, well appointed sushi bar. Boasting one of the most creative chefs in the city and offering a varied and original menu, Aikawa always guarantees market freshness. Come and widen your culinary horizons with Pizza Sushi, Besame Mucho, Romeo and Juliette, and Mango Tango or try the mouth-watering taste of the more traditional dishes. Special events are welcome with two private rooms available to suit any needs. No need to go downtown to delight your taste buds!show more"
683,22,"$ (less than $20), $$ ($20 to $30)",,"Tomato Basilic is an unpretentious home cooking, focused on the quality of its ingredients and its preparation. It's also a warm place, a friendly atmosphere and a service that meets your expectations. Recognized for its excellent quality / price ratio, it is a place to discover and adopt.show more"
684,20,"$ (less than $20), $$ ($20 to $30)",,"Known as a Montreal institution, Le Taj has been deeply entrenched in the downtown core for over 3 decades. The decor at Le Taj represents a true synthesis of the complex, the colourful, the simple and the elegant. Carefully curated with handmade wooden carvings from the early 18th century, juxtaposed with the 12-foot mud wall adorning the backdrop of the dining room - which was in fact the central installation from the Indian Pavilion at Expo ‘67 - the decor often leaves our guests speechless while maintaining a certain feeling of warmth that mirrors the cuisine. At the rear end of the restaurant, our tandoor (traditional clay oven) is visible through a glass wall, leaving guests with a window into the world of our chefs, who can be seen cooking tandoori delicacies from fresh naan to our signature tandoori chicken.Owner, Vinod Kapoor, opened the restaurant in 1985, with the idea of creating a space where Indian food could be devoured within the respected setting it deserved: white table clothes, fine wine and a decor that highlights the rich cultural and artistic history of his native India. Having previously been a collector and dealer of Indian art and antiques, his keen eye for interesting pieces has made its impression on the ambiance of the restaurant, where most of the artwork is one of a kind (including a piece from the Indian Pavilion at Expo ’67!). It is with this same passion that Mr. Kapoor, who can still be seen buzzing around the dining room on a busy night, continues to maintain the high quality and exceptional service to old and new clients alike. Over the years, Le Taj has become a staple for many Montrealers and international clients, with a number of patrons having grown up dining with us and coming back over time with families of their own. In that respect, our own family of dedicated staff members - many of whom have been with us since the very beginning - are in large part how we have built our reputation of excellence for over 30 years. With a large number of our regular patrons making up a who's who, and having been as loyal to us as we have been to them and to our classical recipes, we hope to continue our journey in the mastery of culinary arts and service for many years to come.show more"
685,35,"$$ ($20 to $30), $$$ ($30 to $45)",,"Maison Saint-Paul is all about bubbly, and it has the wine list to prove it. White, rosé, demi-sec, brut, vintage—it’s all there. Cocktails and a fine selection of reds, whites, and rosés round out the drink options. On the food side, mouthwatering apps and delectable mains abound, including the famous foie gras and lobster poutine—sheer bliss. Go ahead, treat yourself!show more"
686,26,"$$ ($20 to $30), $$$ ($30 to $45)",,"Ristorante Portovino is one of the most renowned BYOW destinations in Brossard. Our passion for great food and uncompromising service and attention to detail make every occasion, affordably chic!   At Portovino, we love good food and it's reflected in everything we do. From our mouth-watering appetizers, chef-inspired seasonal culinary creations, to our weekly table d’hôte menu. Portovino is the perfect culinary escape for family and friend gatherings as well as intimate rendez-vous.show more"
687,24,$$$ ($30 to $45),,"Le Saloon is a bar, a restaurant as well a supperclub, and now a famous institution in the Gay Village thanks to its pleasant and casual atmosphere.  You will love this place whether you're just stopping for a few drinks before a show or planning to spend your whole evening.  Renowned for its lively Happy Hour and its bistro-style cuisine featuring local and international specialties, Le Saloon offers a wide variety of dishes - both classical and contemporary.  Le Saloon offers everything you need for a great urban culinary experience that is both accessible and comforting.  Let's not forget the bar with its great ambiance and extensive cocktail list!show more"
688,32,"$ (less than $20), $$ ($20 to $30)",,"The foundation of Rasoï is built on three key elements: fresh high-quality ingredients, traditional Indian cuisine, a cozy & warm ambiance and a friendly staff that will make you feel like you are part of the family.
Rasoï puts a lot of emphasis on using the highest quality meats, seafood, vegetables and fruits, and creating tantalizing flavors using traditional family recipes. Rasoï takes you to India by creating an ambiance full of bright colours, mouth-watering aromas, and a vibrant energy. Our staff will always make you feel at home and part of the family with our friendly service and attention to detail in order to provide you with the best dining experience.show more"
689,16,"$$ ($20 to $30), $$$ ($30 to $45)",,"Restaurant La Piazza is a family owned Italian restaurant. Delightful for dining with family and friends, it is also the ideal setting for hosting of all your corporate events. Located in the center of Bois Franc, this hidden gem is elegantly decorated, with a terrace overlooking acres of green space. Our chef’s specialty is Mediterranean food – from Pasta to Seafood, all dishes are prepared with fresh herbs of the day. Come and enjoy the experience. For reservations please call: (514) 337-0030show more"
690,20,$ (less than $20),,"This classic Vietnamese greasy spoon restaurant is located close by the French Université de Quebec à Montreal, thus serving an enormous student population daily. No surprise either, for Cafe Saigon is a surefire place to find a great bang for your buck. Daily table d'hôte menus at noon will fill you up at a minimal expense and evening dining is not much harder on your wallet.show more"
691,24,$$ ($20 to $30),,"Discover our MENU. The avant-garde and modern Italian menu offered at Tredici was created by our talented chef, Eric Keegan. Tredici welcomes you in a warm atmosphere with careful decoration and offers you a menu composed of Pasta, Pizzas, Salads and more...show more"
693,12,"$$ ($20 to $30), $$$ ($30 to $45)",,"At Le Square restaurant, the staff will be pleased to welcome you everyday in a warm and trendy atmosphere. Come and discover a generous and tasty cuisine and don’t forget to bring your own wine!show more"
694,52,"$ (less than $20), $$ ($20 to $30)",,"WELCOME TO TOI, MOI & CAFÉ  Toi, Moi & Café offers coffee and tea aficionados a haven from the busy world with a bistro style decor and laid back ambiance. Established since 1995 in Mile End, we rapidly became a reference in the art of the espresso, and a pioneer in the fair trade commerce offering still the largest selection of premium fair trade and organic bean in Canada.  Start your day with a satisfying breakfast, take a mid-day break for lunch, or stop in at the end of the day for dinner or a late snack. Indulge in a decadent home-made deserts or the very best latte Montreal has to offer.show more"
696,28,"$$ ($20 to $30), $$$ ($30 to $45)",,"Discover the cuisine of chef Jean-Sébastien Giguère for a real pleasure for the senses! Taste creative and reinvented dishes, concocted from local products, not to mention the prestigious wine cellar, winner of the “Grand Award” since 2018 awarded by Wine Spectator magazine.show more"
697,15,$ (less than $20),,"We are a local pizzeria chain owned by the 3rd generation, which is made up of 5 brothers and sisters! Our goal is to offer you the best pizzas, served quickly and with a smile! We deliver delicious pizzas, comforting poutines and succulent chicken wings!show more"
698,15,"$ (less than $20), $$ ($20 to $30)",,"Bistro CÔ ÚT prepares delicious Vietnamese and grilled dishes. Come to try our imperial rolls, spicy Satay brochettes, grilled mussels, our vegan dishes or our Pho CÔ ÚT which you are the cook. To go with our dishes we have excellent list of imported wines and beers. Come to see us on Plateau Mont-Royal, Montreal !show more"
699,11,$$ ($20 to $30),,"Welcome to Seiyuan:
Positioned strategically in Le Viex-Port de Montréal,  Seiyuan Restaurant entices visitors with its impeccable fusion of sushi and poke bowls to die for. At Seiyuan restaurant, we cater to both, those seeking a swift culinary experience and those looking for a relaxed atmosphere at its inviting Bar Terrasse. Located in the heart of this historic district (the Old Port of Montreal) at 143 rue de la commune, H2Y 1J1, Montreal. 
Seiyuan Restaurant provides an outstanding destination where you can indulge in delightful sushi and poke bowl creations while enjoying the surrounding European ambiance. You'll find everything from flavorsome snacks such as Chicken Pop-corn to leisurely meals to be shared with loved ones and friends. 
Seiyuan Restaurant is where exceptional Japanese  culinary skills meet a golden diner spot full of hospitality and service.
Seiyuan Restaurant's house specialties, including the Poke Bowl, Sushi, and Hosomaki, are a testament to their commitment to culinary excellence. From the vibrant freshness of the Poke Bowl to the artistry of the Sushi and the refined elegance of the Hosomaki, each dish reflects the restaurant's dedication to crafting exceptional flavors and providing an unforgettable dining experience. Prepare to be captivated by the symphony of tastes, textures, and visual appeal that await you at Seiyuan Restaurant.show more"
700,24,$ (less than $20),,"Located in the warm district of Ahuntsic, the restaurant Les Deux Copains will seduce your taste buds with its carefully selected fresh products.  Our diverse menu will satisfy the gourmet in you.  Whether for lunch, dinner or just a coffee, it will be our pleasure to welcome you.Come and discover each week our different table d'hôtes menus composed by our chefs.  Our 4 choices of original dishes are offered to you in a dinner version from Monday to Friday and in a brunch version on Saturday and Sunday.show more"
701,24,"$ (less than $20), $$ ($20 to $30)",,"Located in Laval, our restaurant offers a perfect combination between original cuisine, pleasant ambiance and friendly atmosphere. Whether it's for a business lunch, family dinner or a night out with friends, Edmond Bistro is the perfect place to go.  We offer a vast selection of appetizing meals: our famous pizzas, pastas, grills, salads and fish. All of our dishes are freshly prepared with first grade quality ingredients. Our kitchen staff cook sauces, vinaigrettes, marinades and pizza dough on a daily basis.  The Edmond Bistro team is waiting for you!  Enjoy!show more"
702,29,$ (less than $20),,"Enjoy a moment of relaxation in a warm and country atmosphere.Our passionate team will ensure your pleasure by preparing our original menu, made up of top quality, fresh and healthy foods.Your well-being is our priority, see you soon!show more"
704,17,"$$ ($20 to $30), $$$ ($30 to $45)",,"Discreetly located in the Hotel Le Crystal in the heart of downtown, our restaurant welcomes you in a contemporary Asian decor.  Our gigantic Buddha and our stairs in tropical colors will certainly not leave you indifferent.  In summer, discover our charming colorful terrace for a refreshing cocktail.
 
Thai cuisine is considered the finest in Asia.  Its original and delicate ingredients such as curry, mint, lemongrass, coriander, kaffir lime or even red basil, its fragrances and its colorful and spectacular presentations will make you travel.  But beware, it is also very spicy and can represent a real challenge for the taste buds!
 
Siam offers you the great classics such as pad thai and curries, presented in a contemporary way.  Our grandiose and warm decor as well as our dedicated staff invite you to come and experience the tradition of sharing typical in Asia.  The address to remember for your business lunches, special events or just a good meal.show more"
705,20,"$$$ ($30 to $45), $$$$ (over $45)",,Welcome to Piatti! Italian cuisine and a wood oven...in a magical setting by Jean-Claude Poitras. We are open for lunch Monday to Friday and every evening. A large terrace in season and private rooms that can accommodate groups. A large parking lot at the rear of the restaurant.show more
706,5,"$$ ($20 to $30), $$$ ($30 to $45)",,"Fenetre sur Kaboul Restaurant is located on Rachel street, near Park Lafontaine. Come enjoy a gastronomic dining experience like no other!  On the menu are Halal meats, as well as dishes prepared with the freshest ingredients, ensuring that we can offer you a fine Afghan dining experience. You will be delighted by all the different flavors! In addition, whether you are a business man or a student, everyone receives a courteous and warm service.  Bring Your Own Wine and enjoy an absolutely divine meal!show more"
707,14,$$$$ (over $45),,"In a currently non-existent mould, BRUT. defines itself as a new kind of grocery store, fully equipped with an open area where all the products sold are made directly on site and in front of the customers. Our business is a gateway to sharing our values: love, sensitivity to the use and promotion of local products.show more"
708,22,$ (less than $20),,"Nikos Pizza & Déli Restaurant is the perfect choice for pizzas and Greek specialties. You have plenty of selections to choose from such as hot sandwiches, chicken wings, poutines and even grilled meats. No other restaurant can compare to Nikos Pizza & Deli when there are trios at the best price!show more"
710,14,"$$ ($20 to $30), $$$ ($30 to $45)",,"Welcome to the world of Madame Bovary, a festive restaurant with a menu of contemporary small dishes, a signature cocktail card and a private import wine list. Inspired by the story of Madame Bovary, the cozy design space includes a 160-seat restaurant, two bar areas, semi-private lounges and a billiard room.
We are happy to welcome you in a unique place where we wish to marry the pleasures of the table, art and culture to offer you unforgettable moments. (18+)show more"
711,28,"$ (less than $20), $$ ($20 to $30)",,"Nestled in Lachine Montreal, Makaya, offers a unique chocolate lounge experience, showcasing the finest chocolates sourced from Haiti. Our lounge is a haven for chocolate lovers, where every bite tells a story of rich Haitian heritage and premium quality. Indulge in our diverse range of chocolates, each crafted to provide a new and exciting taste experience. Join us at Makaya for a journey through the exquisite flavors of Haiti, right in the heart of Montreal.show more"
712,14,"$ (less than $20), $$ ($20 to $30)",,"Come and have fun in a relaxed atmosphere!The Randolph Pub Ludique DIX30 invites you to play a host of games, offered and explained by our passionate entertainers. To make the experience more complete, our waiters and waitresses will come to see you to offer you something to eat and drink. Try our microbrewery beers, cocktails and potions while enjoying a variety of appetizers and dishes prepared by our experienced staff.show more"
713,21,$ (less than $20),,"THE HISTORY OF LA BINERIE MONT-ROYAL June 11th, 1938 Joachim Lussier is the founder and first owner of La Binerie MONT-ROYAL. Assisted by his brother Leo, he decided that the traditional Quebec cuisine and family spirit are the pillars of the establishment. During the first 60 years, several members of their families worked at the restaurant and left their contributions and memories with the customers. La Binerie Mont-Royal has become a culinary institution in Quebec, which is proud to offer authentic Quebec cuisine to all those who want to remember the good experiences of family meals. Memorable experiences are created for all new customers! July 13th, 1966 Leo buys his brother's restaurant. In October of the same year, he hired a ""new kid"", a waiter, Fernand Groulx rapidly integrating with the Lussier family. In October 1969, Fernand weds Claire, Leo’s eldest daughter. So when Leo decided to retire - he knew that there was someone to take his place! August 4th, 1978, after 40 years of service, Leo sells La Binerie Mont-Royal to Fernand and Claire. The two work together for over 30 years! March 10th, 2001, the secret recipes of La Binerie Mont-Royal are given to a trio of restaurants in Quebec which brought some physical improvements to the restaurant. In March 2002, the torch of Quebec cuisine was purchased and continued by Suzanne Touchette and Bernard Deschamps. November 17th, 2005, Jocelyne and Philippe Brunet became the happy recipients of La Binerie Mont-Royal. They were looking for several months for a restaurant that offered food and special experience, which also had development potential. In hopes of making a cozier restaurant, the bar and the tables are now solid maple and walls are covered with pictures of our family traditions from the great Quebec illustrator Joseph-Edmond Massicotte. Several improvements in the menu were made and continue to be, so that the dishes offered can live up to the required quality, while respecting the authenticity of the Quebec cuisine! They like to offer their loyal customers and the many visitors from other countries, the pleasure of enjoying traditional dishes, making sure they leave with a good memory! Eating at La Binerie Mount Royal... is putting Quebec on your plate! At the La Binerie, you will feel at home!show more"
714,18,$ (less than $20),,Barranco is a modern Peruvian cuisine restaurant located in the heart of Plateau Mont-Royal on Saint-Denis Street. It offers authentic flavors thanks to several products imported directly from Peru.show more
